"id","status","title","size","description","price","sale_price","availability","condition","material","brand","additional_image_link","google product category","link","image_link","gtin","mpn","fb_product_category"
"4","active","Liberté enragé no 2 2019","24x36","Acrylic Painting (ORIGINAL SOLD)","900 CAD","850 CAD","in stock","new","Acrylic, Canvas","ap__unrooter_anger_no_2__24x36__191109_IMG_0028","","5710","https://guillaumeisabelle.com/l/4.htm","https://guillaumeisabelle.com/img/acrylics-painting/mn/ap__unrooter_anger_no_2__24x36__191109_IMG_0028.jpg","","ap__unrooter_anger_no_2__24x36__191109_IMG_0028","999"
"5","active","Wirly 2019","16x20","Acrylic Painting","160 CAD","150 CAD","in stock","new","Acrylic, Canvas","ap__wirly__16x20__191110","","5710","https://guillaumeisabelle.com/l/5.htm","https://guillaumeisabelle.com/img/acrylics-painting/mn/ap__wirly__16x20__191110.jpg","","ap__wirly__16x20__191110","999"
"1","active","Articol no 1","20X24","Peinture acrylique fabriqué avec un nouveau médium collaboratif qui se resource dans l'intelligence artificielle (IA). 
Cet ajout à mon processus me permet d'explorer au préalable de l'acte de peindre, des lieux créatifs. 
Ces derniers ne sont accessible que dans le nouveau paradigme de traitement de données avec l'IA.","400 CAD","300 CAD","in stock","new","Acrylic, Canvas","ap_articol_no_01__20x24__220320","https://guillaumeisabelle.com/img/acrylics-painting/additional/ap_articol_no_01__20x24__220320__CHEVALET.jpg","5710","https://guillaumeisabelle.com/l/1.htm","https://guillaumeisabelle.com/img/acrylics-painting/mn/ap_articol_no_01__20x24__220320.jpg","","ap_articol_no_01__20x24__220320","999"
"2","active","Laax no 2 / 2017","24x36","Acrylic Painting produite pendant le cours ""Créer sa vie"". Exercise de créer en 30 minutes.Made during the course ""Life as Art"". 
30 min creating exercise.","600 CAD","500 CAD","in stock","new","Acrylic, Canvas","ap_laa_xno_2__24x36__191109","","5710","https://guillaumeisabelle.com/l/2.htm","https://guillaumeisabelle.com/img/acrylics-painting/mn/ap_laa_xno_2__24x36__191109.jpg","","ap_laa_xno_2__24x36__191109","999"
"6","active","Russ Art Life  no 3","16x20","Petite oeuvre acrylique abstraite douce créé pendant un de mes cours . Exercise de créer en 5-15 minutes.  Sweet little peace of work made during one of my art course.  Exercise of creating in 5-15  minutes. ","200 CAD","160 CAD","in stock","new","Acrylic, Canvas","ap__russia__laa_no_3__16x20__191110","","5710","https://guillaumeisabelle.com/l/6.htm","https://guillaumeisabelle.com/img/acrylics-painting/mn/ap__russia__laa_no_3__16x20__191110.jpg","","ap__russia__laa_no_3__16x20__191110","999"
"7","active","Bluenlite","16x20","Acrylique","200 CAD","150 CAD","in stock","new","Acrylic, Canvas","ap__bluenlite__16x20__220408","","5710","https://guillaumeisabelle.com/l/7.htm","https://guillaumeisabelle.com/img/acrylics-painting/mn/ap__bluenlite__16x20__220408.jpg","","ap__bluenlite__16x20__220408","999"
"3","active","Keep Talking","16x20","Mouvement","200 CAD","160 CAD","in stock","new","Acrylic, Canvas","ap__talking__16x20__191110","","5710","https://guillaumeisabelle.com/l/3.htm","https://guillaumeisabelle.com/img/acrylics-painting/mn/ap__talking__16x20__191110.jpg","","ap__talking__16x20__191110","999"